--
05:00:01.595177 IP 10.25.15.182.52825 > 10.25.15.91.ftp: Flags [.], ack 1, win 229, options [nop,nop,TS val 385885755 ecr 98091997], length 0
E..4L.@.@...
...
..[.Y...@j.s$.............
..&;....
05:00:01.601416 IP 10.25.15.91.ftp > 10.25.15.182.52825: Flags [P.], seq 1:66, ack 1, win 227, options [nop,nop,TS val 98091999 ecr 385885755], length 65
E..u..@.@.4{
..[
......Ys$...@j............
......&;220 ProFTPD 1.3.5rc3 Server (elec1200xftp) [::ffff:10.25.15.91]

05:00:01.603164 IP 10.25.15.182.52825 > 10.25.15.91.ftp: Flags [.], ack 66, win 229, options [nop,nop,TS val 385885763 ecr 98091999], length 0
E..4L.@.@...
...
..[.Y...@j.s$.Y.....{.....
..&C....
05:00:01.611400 IP 10.25.15.182.52825 > 10.25.15.91.ftp: Flags [P.], seq 1:16, ack 66, win 229, options [nop,nop,TS val 385885771 ecr 98091999], length 15
E..CL.@.@...
...
..[.Y...@j.s$.Y...........
..&K....USER labuser8

05:00:01.611500 IP 10.25.15.91.ftp > 10.25.15.182.52825: Flags [.], ack 16, win 227, options [nop,nop,TS val 98092002 ecr 385885771], length 0
E..4..@.@.4.
..[
......Ys$.Y.@k......c.....
......&K
05:00:01.612349 IP 10.25.15.91.ftp > 10.25.15.182.52825: Flags [P.], seq 66:102, ack 16, win 227, options [nop,nop,TS val 98092002 ecr 385885771], length 36
E..X..@.@.4.
..[
......Ys$.Y.@k.....\Z.....
......&K331 Password required for labuser8

05:00:01.621384 IP 10.25.15.182.52825 > 10.25.15.91.ftp: Flags [P.], seq 16:33, ack 102, win 229, options [nop,nop,TS val 385885781 ecr 98092002], length 17
E..EL.@.@...
...
..[.Y...@k.s$.}...........
..&U....PASS G4684sA4w=

05:00:01.645847 IP 10.25.15.91.ftp > 10.25.15.182.52825: Flags [P.], seq 102:131, ack 33, win 227, options [nop,nop,TS val 98092010 ecr 385885781], length 29
E..Q..@.@.4.
..[
......Ys$.}.@k.....V8.....
......&U230 User labuser8 logged in
--
05:01:01.900058 IP 10.25.15.182.52827 > 10.25.15.91.ftp: Flags [.], ack 1, win 229, options [nop,nop,TS val 385946059 ecr 98107073], length 0
E..4.<@.@.FE
...
..[.[..qe....f .....t.....
........
05:01:01.908393 IP 10.25.15.91.ftp > 10.25.15.182.52827: Flags [P.], seq 1:66, ack 1, win 227, options [nop,nop,TS val 98107076 ecr 385946059], length 65
E..u..@.@.n^
..[
......[..f qe.............
........220 ProFTPD 1.3.5rc3 Server (elec1200xftp) [::ffff:10.25.15.91]

05:01:01.909043 IP 10.25.15.182.52827 > 10.25.15.91.ftp: Flags [.], ack 66, win 229, options [nop,nop,TS val 385946068 ecr 98107076], length 0
E..4.=@.@.FD
...
..[.[..qe....fa.....'.....
........
05:01:01.913834 IP 10.25.15.182.52827 > 10.25.15.91.ftp: Flags [P.], seq 1:17, ack 66, win 229, options [nop,nop,TS val 385946073 ecr 98107076], length 16
E..D.>@.@.F3
...
..[.[..qe....fa.....u.....
........USER labuser11

05:01:01.913935 IP 10.25.15.91.ftp > 10.25.15.182.52827: Flags [.], ack 17, win 227, options [nop,nop,TS val 98107077 ecr 385946073], length 0
E..4..@.@.n.
..[
......[..faqe.............
........
05:01:01.914785 IP 10.25.15.91.ftp > 10.25.15.182.52827: Flags [P.], seq 66:103, ack 17, win 227, options [nop,nop,TS val 98107077 ecr 385946073], length 37
E..Y..@.@.nx
..[
......[..faqe......
.....
........331 Password required for labuser11

05:01:01.924219 IP 10.25.15.182.52827 > 10.25.15.91.ftp: Flags [P.], seq 17:34, ack 103, win 229, options [nop,nop,TS val 385946084 ecr 98107077], length 17
E..E.?@.@.F1
...
..[.[..qe....f......F.....
........PASS B=6oxsyvv4

05:01:01.952574 IP 10.25.15.91.ftp > 10.25.15.182.52827: Flags [P.], seq 103:133, ack 34, win 227, options [nop,nop,TS val 98107087 ecr 385946084], length 30
E..R..@.@.n~
..[
......[..f.qe......8......
........230 User labuser11 logged in
--
05:02:01.227980 IP 10.25.15.182.52829 > 10.25.15.91.ftp: Flags [.], ack 1, win 229, options [nop,nop,TS val 386005387 ecr 98121905], length 0
E..4.T@.@.7-
...
..[.]....)..........{.....
......8.
05:02:01.234220 IP 10.25.15.91.ftp > 10.25.15.182.52829: Flags [P.], seq 1:66, ack 1, win 227, options [nop,nop,TS val 98121907 ecr 386005387], length 65
E..u..@.@.^.
..[
......]......)............
..8.....220 ProFTPD 1.3.5rc3 Server (elec1200xftp) [::ffff:10.25.15.91]

05:02:01.235170 IP 10.25.15.182.52829 > 10.25.15.91.ftp: Flags [.], ack 66, win 229, options [nop,nop,TS val 386005395 ecr 98121907], length 0
E..4.U@.@.7,
...
..[.]....)....`.....0.....
......8.
05:02:01.237316 IP 10.25.15.182.52829 > 10.25.15.91.ftp: Flags [P.], seq 1:17, ack 66, win 229, options [nop,nop,TS val 386005397 ecr 98121907], length 16
E..D.V@.@.7.
...
..[.]....)....`...........
......8.USER labuser22

05:02:01.237416 IP 10.25.15.91.ftp > 10.25.15.182.52829: Flags [.], ack 17, win 227, options [nop,nop,TS val 98121908 ecr 386005397], length 0
E..4..@.@.^.
..[
......]...`..)............
..8.....
05:02:01.238215 IP 10.25.15.91.ftp > 10.25.15.182.52829: Flags [P.], seq 66:103, ack 17, win 227, options [nop,nop,TS val 98121908 ecr 386005397], length 37
E..Y..@.@.^.
..[
......]...`..).....M......
..8.....331 Password required for labuser22

05:02:01.247151 IP 10.25.15.182.52829 > 10.25.15.91.ftp: Flags [P.], seq 17:34, ack 103, win 229, options [nop,nop,TS val 386005406 ecr 98121908], length 17
E..E.W@.@.7.
...
..[.]....)................
......8.PASS KJ4UJAh$Tx

05:02:01.274058 IP 10.25.15.91.ftp > 10.25.15.182.52829: Flags [P.], seq 103:133, ack 34, win 227, options [nop,nop,TS val 98121917 ecr 386005406], length 30
E..R..@.@.^.
..[
......]......).....{......
..8.....230 User labuser22 logged in
--
05:03:01.432521 IP 10.25.15.182.52831 > 10.25.15.91.ftp: Flags [.], ack 1, win 229, options [nop,nop,TS val 386065592 ecr 98136956], length 0
E..4..@.@.).
...
..[._...!9J.>......FR.....
......s|
05:03:01.438710 IP 10.25.15.91.ftp > 10.25.15.182.52831: Flags [P.], seq 1:66, ack 1, win 227, options [nop,nop,TS val 98136958 ecr 386065592], length 65
E..u.h@.@...
..[
......_.>...!9J....'i.....
..s~....220 ProFTPD 1.3.5rc3 Server (elec1200xftp) [::ffff:10.25.15.91]

05:03:01.440808 IP 10.25.15.182.52831 > 10.25.15.91.ftp: Flags [.], ack 66, win 229, options [nop,nop,TS val 386065600 ecr 98136958], length 0
E..4..@.@.).
...
..[._...!9J.>.U....F......
......s~
05:03:01.442656 IP 10.25.15.182.52831 > 10.25.15.91.ftp: Flags [P.], seq 1:17, ack 66, win 229, options [nop,nop,TS val 386065602 ecr 98136958], length 16
E..D..@.@.)o
...
..[._...!9J.>.U.....V.....
......s~USER labuser33

05:03:01.442804 IP 10.25.15.91.ftp > 10.25.15.182.52831: Flags [.], ack 17, win 227, options [nop,nop,TS val 98136959 ecr 386065602], length 0
E..4.i@.@...
..[
......_.>.U.!9Z....E......
..s.....
05:03:01.443603 IP 10.25.15.91.ftp > 10.25.15.182.52831: Flags [P.], seq 66:103, ack 17, win 227, options [nop,nop,TS val 98136959 ecr 386065602], length 37
E..Y.j@.@...
..[
......_.>.U.!9Z...........
..s.....331 Password required for labuser33

05:03:01.458180 IP 10.25.15.182.52831 > 10.25.15.91.ftp: Flags [P.], seq 17:34, ack 103, win 229, options [nop,nop,TS val 386065617 ecr 98136959], length 17
E..E..@.@.)m
...
..[._...!9Z.>.z.....G.....
......s.PASS N$tdUhoc6D

05:03:01.482542 IP 10.25.15.91.ftp > 10.25.15.182.52831: Flags [P.], seq 103:133, ack 34, win 227, options [nop,nop,TS val 98136969 ecr 386065617], length 30
E..R.k@.@...
..[
......_.>.z.!9k...........
..s.....230 User labuser33 logged in
--
05:04:01.654681 IP 10.25.15.182.52833 > 10.25.15.91.ftp: Flags [.], ack 1, win 229, options [nop,nop,TS val 386125814 ecr 98152011], length 0
E..4..@.@...
...
..[.a..V..9.L).....^	.....
.......K
05:04:01.659971 IP 10.25.15.91.ftp > 10.25.15.182.52833: Flags [P.], seq 1:66, ack 1, win 227, options [nop,nop,TS val 98152013 ecr 386125814], length 65
E..u..@.@..a
..[
......a.L).V..9....? .....
...M....220 ProFTPD 1.3.5rc3 Server (elec1200xftp) [::ffff:10.25.15.91]

05:04:01.660721 IP 10.25.15.182.52833 > 10.25.15.91.ftp: Flags [.], ack 66, win 229, options [nop,nop,TS val 386125820 ecr 98152013], length 0
E..4..@.@...
...
..[.a..V..9.L).....]......
.......M
05:04:01.667611 IP 10.25.15.182.52833 > 10.25.15.91.ftp: Flags [P.], seq 1:17, ack 66, win 229, options [nop,nop,TS val 386125827 ecr 98152013], length 16
E..D..@.@...
...
..[.a..V..9.L).....%	.....
.......MUSER labuser44

05:04:01.667711 IP 10.25.15.91.ftp > 10.25.15.182.52833: Flags [.], ack 17, win 227, options [nop,nop,TS val 98152015 ecr 386125827], length 0
E..4..@.@...
..[
......a.L).V..I....]......
...O....
05:04:01.668460 IP 10.25.15.91.ftp > 10.25.15.182.52833: Flags [P.], seq 66:103, ack 17, win 227, options [nop,nop,TS val 98152015 ecr 386125827], length 37
E..Y..@.@..{
..[
......a.L).V..I...........
...O....331 Password required for labuser44

05:04:01.677796 IP 10.25.15.182.52833 > 10.25.15.91.ftp: Flags [P.], seq 17:34, ack 103, win 229, options [nop,nop,TS val 386125837 ecr 98152015], length 17
E..E..@.@...
...
..[.a..V..I.L)............
......OPASS fWkiP3L=Xz

05:04:01.703755 IP 10.25.15.91.ftp > 10.25.15.182.52833: Flags [P.], seq 103:133, ack 34, win 227, options [nop,nop,TS val 98152024 ecr 386125837], length 30
E..R..@.@...
..[
......a.L).V..Z.....F.....
...X...230 User labuser44 logged in
--
05:05:01.902252 IP 10.25.15.182.52835 > 10.25.15.91.ftp: Flags [.], ack 1, win 229, options [nop,nop,TS val 386186062 ecr 98167073], length 0
E..4V.@.@..z
...
..[.c.."..K.e.d....H......
...N...!
05:05:01.908391 IP 10.25.15.91.ftp > 10.25.15.182.52835: Flags [P.], seq 1:66, ack 1, win 227, options [nop,nop,TS val 98167075 ecr 386186062], length 65
E..uBF@.@...
..[
......c.e.d"..K....)&.....
...#...N220 ProFTPD 1.3.5rc3 Server (elec1200xftp) [::ffff:10.25.15.91]

05:05:01.908991 IP 10.25.15.182.52835 > 10.25.15.91.ftp: Flags [.], ack 66, win 229, options [nop,nop,TS val 386186068 ecr 98167075], length 0
E..4V.@.@..y
...
..[.c.."..K.e......G......
...T...#
05:05:01.916232 IP 10.25.15.182.52835 > 10.25.15.91.ftp: Flags [P.], seq 1:17, ack 66, win 229, options [nop,nop,TS val 386186076 ecr 98167075], length 16
E..DV	@.@..h
...
..[.c.."..K.e............
...\...#USER labuser55

05:05:01.916329 IP 10.25.15.91.ftp > 10.25.15.182.52835: Flags [.], ack 17, win 227, options [nop,nop,TS val 98167077 ecr 386186076], length 0
E..4BG@.@..:
..[
......c.e.."..[....G......
...%...\
05:05:01.917179 IP 10.25.15.91.ftp > 10.25.15.182.52835: Flags [P.], seq 66:103, ack 17, win 227, options [nop,nop,TS val 98167077 ecr 386186076], length 37
E..YBH@.@...
..[
......c.e.."..[...........
...%...\331 Password required for labuser55

05:05:01.926563 IP 10.25.15.182.52835 > 10.25.15.91.ftp: Flags [P.], seq 17:34, ack 103, win 229, options [nop,nop,TS val 386186086 ecr 98167077], length 17
E..EV
@.@..f
...
..[.c.."..[.e......	......
...f...%PASS PKhg==d9wF

05:05:01.954868 IP 10.25.15.91.ftp > 10.25.15.182.52835: Flags [P.], seq 103:133, ack 34, win 227, options [nop,nop,TS val 98167087 ecr 386186086], length 30
E..RBI@.@...
..[
......c.e.."..l.....I.....
.../...f230 User labuser55 logged in
--
05:06:01.106671 IP 10.25.15.182.52837 > 10.25.15.91.ftp: Flags [.], ack 1, win 229, options [nop,nop,TS val 386245266 ecr 98181874], length 0
E..4^.@.@...
...
..[.e...	.e...J.....u.....
......".
05:06:01.110662 IP 10.25.15.91.ftp > 10.25.15.182.52837: Flags [P.], seq 1:66, ack 1, win 227, options [nop,nop,TS val 98181876 ecr 386245266], length 65
E..u3.@.@...
..[
......e...J.	.e...........
..".....220 ProFTPD 1.3.5rc3 Server (elec1200xftp) [::ffff:10.25.15.91]

05:06:01.111462 IP 10.25.15.182.52837 > 10.25.15.91.ftp: Flags [.], ack 66, win 229, options [nop,nop,TS val 386245271 ecr 98181876], length 0
E..4^.@.@...
...
..[.e...	.e.........-.....
......".
05:06:01.112161 IP 10.25.15.182.52837 > 10.25.15.91.ftp: Flags [P.], seq 1:17, ack 66, win 229, options [nop,nop,TS val 386245271 ecr 98181876], length 16
E..D^.@.@..y
...
..[.e...	.e.........{.....
......".USER labuser66

05:06:01.112311 IP 10.25.15.91.ftp > 10.25.15.182.52837: Flags [.], ack 17, win 227, options [nop,nop,TS val 98181876 ecr 386245271], length 0
E..43.@.@...
..[
......e.....	.u...........
..".....
05:06:01.113060 IP 10.25.15.91.ftp > 10.25.15.182.52837: Flags [P.], seq 66:103, ack 17, win 227, options [nop,nop,TS val 98181876 ecr 386245271], length 37
E..Y3.@.@...
..[
......e.....	.u...........
..".....331 Password required for labuser66

05:06:01.121846 IP 10.25.15.182.52837 > 10.25.15.91.ftp: Flags [P.], seq 17:34, ack 103, win 229, options [nop,nop,TS val 386245281 ecr 98181876], length 17
E..E^.@.@..w
...
..[.e...	.u...............
......".PASS D$PBsR3AU8

05:06:01.146858 IP 10.25.15.91.ftp > 10.25.15.182.52837: Flags [P.], seq 103:133, ack 34, win 227, options [nop,nop,TS val 98181885 ecr 386245281], length 30
E..R3.@.@...
..[
......e.....	......L......
..".....230 User labuser66 logged in
--
05:07:01.300677 IP 10.25.15.182.52839 > 10.25.15.91.ftp: Flags [.], ack 1, win 229, options [nop,nop,TS val 386305460 ecr 98196923], length 0
E..4.i@.@.s.
...
..[.g..|m..I.J.....@......
......].
05:07:01.306966 IP 10.25.15.91.ftp > 10.25.15.182.52839: Flags [P.], seq 1:66, ack 1, win 227, options [nop,nop,TS val 98196924 ecr 386305460], length 65
E..u..@.@..4
..[
......gI.J.|m......!......
..].....220 ProFTPD 1.3.5rc3 Server (elec1200xftp) [::ffff:10.25.15.91]

05:07:01.311260 IP 10.25.15.182.52839 > 10.25.15.91.ftp: Flags [.], ack 66, win 229, options [nop,nop,TS val 386305471 ecr 98196924], length 0
E..4.j@.@.s.
...
..[.g..|m..I.J.....@......
......].
05:07:01.311515 IP 10.25.15.182.52839 > 10.25.15.91.ftp: Flags [P.], seq 1:17, ack 66, win 229, options [nop,nop,TS val 386305471 ecr 98196924], length 16
E..D.k@.@.s.
...
..[.g..|m..I.J............
......].USER labuser77

05:07:01.311609 IP 10.25.15.91.ftp > 10.25.15.182.52839: Flags [.], ack 17, win 227, options [nop,nop,TS val 98196926 ecr 386305471], length 0
E..4.@.@..t
..[
......gI.J.|m......@v.....
..].....
05:07:01.312309 IP 10.25.15.91.ftp > 10.25.15.182.52839: Flags [P.], seq 66:103, ack 17, win 227, options [nop,nop,TS val 98196926 ecr 386305471], length 37
E..Y..@.@..N
..[
......gI.J.|m.......i.....
..].....331 Password required for labuser77

05:07:01.317500 IP 10.25.15.182.52839 > 10.25.15.91.ftp: Flags [P.], seq 17:34, ack 103, win 229, options [nop,nop,TS val 386305477 ecr 98196926], length 17
E..E.l@.@.s.
...
..[.g..|m..I.K............
......].PASS Jy$Gm6VzMz

05:07:01.339967 IP 10.25.15.91.ftp > 10.25.15.182.52839: Flags [P.], seq 103:133, ack 34, win 227, options [nop,nop,TS val 98196933 ecr 386305477], length 30
E..R..@.@..T
..[
......gI.K.|m.............
..].....230 User labuser77 logged in
--
05:08:01.484451 IP 10.25.15.182.52841 > 10.25.15.91.ftp: Flags [.], ack 1, win 229, options [nop,nop,TS val 386365644 ecr 98211968], length 0
E..4..@.@.r.
...
..[.i.....s...............
..x.....
05:08:01.490641 IP 10.25.15.91.ftp > 10.25.15.182.52841: Flags [P.], seq 1:66, ack 1, win 227, options [nop,nop,TS val 98211970 ecr 386365644], length 65
E..u..@.@.o"
..[
......i.......s...........
......x.220 ProFTPD 1.3.5rc3 Server (elec1200xftp) [::ffff:10.25.15.91]

05:08:01.491640 IP 10.25.15.182.52841 > 10.25.15.91.ftp: Flags [.], ack 66, win 229, options [nop,nop,TS val 386365651 ecr 98211970], length 0
E..4..@.@.r.
...
..[.i.....s...............
..x.....
05:08:01.495684 IP 10.25.15.182.52841 > 10.25.15.91.ftp: Flags [P.], seq 1:17, ack 66, win 229, options [nop,nop,TS val 386365655 ecr 98211970], length 16
E..D..@.@.r.
...
..[.i.....s...............
..x.....USER labuser88

05:08:01.495783 IP 10.25.15.91.ftp > 10.25.15.182.52841: Flags [.], ack 17, win 227, options [nop,nop,TS val 98211972 ecr 386365655], length 0
E..4..@.@.ob
..[
......i...................
......x.
05:08:01.496482 IP 10.25.15.91.ftp > 10.25.15.182.52841: Flags [P.], seq 66:103, ack 17, win 227, options [nop,nop,TS val 98211972 ecr 386365655], length 37
E..Y. @.@.o<
..[
......i...................
......x.331 Password required for labuser88

05:08:01.501324 IP 10.25.15.182.52841 > 10.25.15.91.ftp: Flags [P.], seq 17:34, ack 103, win 229, options [nop,nop,TS val 386365660 ecr 98211972], length 17
E..E..@.@.r.
...
..[.i...............L.....
..x.....PASS Wwod7b$HKP

05:08:01.528532 IP 10.25.15.91.ftp > 10.25.15.182.52841: Flags [P.], seq 103:133, ack 34, win 227, options [nop,nop,TS val 98211980 ecr 386365660], length 30
E..R.!@.@.oB
..[
......i............>@.....
......x.230 User labuser88 logged in
--
E..4Q.@.@...
...
..[.k...b5.../.....A......
..d....N
05:09:01.704066 IP 10.25.15.91.ftp > 10.25.15.182.52843: Flags [P.], seq 1:66, ack 1, win 227, options [nop,nop,TS val 98227023 ecr 386425859], length 65
E..u..@.@.
z
..[
......k../..b5....."&.....
...O..d.220 ProFTPD 1.3.5rc3 Server (elec1200xftp) [::ffff:10.25.15.91]

05:09:01.704816 IP 10.25.15.182.52843 > 10.25.15.91.ftp: Flags [.], ack 66, win 229, options [nop,nop,TS val 386425864 ecr 98227023], length 0
E..4Q.@.@...
...
..[.k...b5.../.....@......
..d....O
05:09:01.711856 IP 10.25.15.182.52843 > 10.25.15.91.ftp: Flags [P.], seq 1:17, ack 66, win 229, options [nop,nop,TS val 386425871 ecr 98227023], length 16
E..DQ.@.@...
...
..[.k...b5.../............
..d....OUSER labuser99

05:09:01.712004 IP 10.25.15.91.ftp > 10.25.15.182.52843: Flags [.], ack 17, win 227, options [nop,nop,TS val 98227025 ecr 386425871], length 0
E..4..@.@.
.
..[
......k../..b5.....@......
...Q..d.
05:09:01.712703 IP 10.25.15.91.ftp > 10.25.15.182.52843: Flags [P.], seq 66:103, ack 17, win 227, options [nop,nop,TS val 98227026 ecr 386425871], length 37
E..Y..@.@.
.
..[
......k../..b5............
...R..d.331 Password required for labuser99

05:09:01.721790 IP 10.25.15.182.52843 > 10.25.15.91.ftp: Flags [P.], seq 17:34, ack 103, win 229, options [nop,nop,TS val 386425881 ecr 98227026], length 17
E..EQ.@.@...
...
..[.k...b5.../............
..d....RPASS iN$bL4zxuU

05:09:01.747499 IP 10.25.15.91.ftp > 10.25.15.182.52843: Flags [P.], seq 103:133, ack 34, win 227, options [nop,nop,TS val 98227034 ecr 386425881], length 30
E..R..@.@.
.
..[
......k../..b5......H.....
...Z..d.230 User labuser99 logged in
--
05:10:01.987285 IP 10.25.15.182.52845 > 10.25.15.91.ftp: Flags [.], ack 1, win 229, options [nop,nop,TS val 386486147 ecr 98242094], length 0
E..4..@.@.t.
...
..[.m.....w..............
.	O.....
05:10:01.993622 IP 10.25.15.91.ftp > 10.25.15.182.52845: Flags [P.], seq 1:66, ack 1, win 227, options [nop,nop,TS val 98242096 ecr 386486147], length 65
E..u.#@.@...
..[
......m......w....f......
...0.	O.220 ProFTPD 1.3.5rc3 Server (elec1200xftp) [::ffff:10.25.15.91]

05:10:01.994372 IP 10.25.15.182.52845 > 10.25.15.91.ftp: Flags [.], ack 66, win 229, options [nop,nop,TS val 386486154 ecr 98242096], length 0
E..4..@.@.t.
...
..[.m.....w...N.....h.....
.	O....0
05:10:01.998317 IP 10.25.15.182.52845 > 10.25.15.91.ftp: Flags [P.], seq 1:16, ack 66, win 229, options [nop,nop,TS val 386486158 ecr 98242096], length 15
E..C..@.@.tx
...
..[.m.....w...N....K......
.	O....0USER labuser8

05:10:01.998466 IP 10.25.15.91.ftp > 10.25.15.182.52845: Flags [.], ack 16, win 227, options [nop,nop,TS val 98242097 ecr 386486158], length 0
E..4.$@.@..]
..[
......m...N.........V.....
...1.	O.
05:10:01.999316 IP 10.25.15.91.ftp > 10.25.15.182.52845: Flags [P.], seq 66:102, ack 16, win 227, options [nop,nop,TS val 98242097 ecr 386486158], length 36
E..X.%@.@..8
..[
......m...N.........M.....
...1.	O.331 Password required for labuser8

05:10:02.004407 IP 10.25.15.182.52845 > 10.25.15.91.ftp: Flags [P.], seq 16:33, ack 102, win 229, options [nop,nop,TS val 386486164 ecr 98242097], length 17
E..E..@.@.tu
...
..[.m.........r....f......
.	O....1PASS G4684sA4w=

05:10:02.030117 IP 10.25.15.91.ftp > 10.25.15.182.52845: Flags [P.], seq 102:131, ack 33, win 227, options [nop,nop,TS val 98242105 ecr 386486164], length 29
E..Q.&@.@..>
..[
......m...r........./.....
...9.	O.230 User labuser8 logged in
--
.
6...H.
05:11:01.207224 IP 10.25.15.91.ftp > 10.25.15.182.52847: Flags [P.], seq 1:66, ack 1, win 227, options [nop,nop,TS val 98256899 ecr 386545361], length 65
E..u.N@.@.b.
..[
......o...O.<............
..H..
6.220 ProFTPD 1.3.5rc3 Server (elec1200xftp) [::ffff:10.25.15.91]

05:11:01.208622 IP 10.25.15.182.52847 > 10.25.15.91.ftp: Flags [.], ack 66, win 229, options [nop,nop,TS val 386545368 ecr 98256899], length 0
E..4..@.@.>o
...
..[.o...<.................
.
6...H.
05:11:01.212867 IP 10.25.15.182.52847 > 10.25.15.91.ftp: Flags [P.], seq 1:17, ack 66, win 229, options [nop,nop,TS val 386545372 ecr 98256899], length 16
E..D..@.@.>^
...
..[.o...<.................
.
6...H.USER labuser11

05:11:01.212967 IP 10.25.15.91.ftp > 10.25.15.182.52847: Flags [.], ack 17, win 227, options [nop,nop,TS val 98256900 ecr 386545372], length 0
E..4.O@.@.c2
..[
......o.....<.............
..H..
6.
05:11:01.213716 IP 10.25.15.91.ftp > 10.25.15.182.52847: Flags [P.], seq 66:103, ack 17, win 227, options [nop,nop,TS val 98256901 ecr 386545372], length 37
E..Y.P@.@.c.
..[
......o.....<.............
..H..
6.331 Password required for labuser11

05:11:01.214365 IP 10.25.15.182.52847 > 10.25.15.91.ftp: Flags [P.], seq 17:34, ack 103, win 229, options [nop,nop,TS val 386545374 ecr 98256901], length 17
E..E..@.@.>\
...
..[.o...<..........*......
.
6...H.PASS B=6oxsyvv4

05:11:01.239974 IP 10.25.15.91.ftp > 10.25.15.182.52847: Flags [P.], seq 103:133, ack 34, win 227, options [nop,nop,TS val 98256907 ecr 386545374], length 30
E..R.Q@.@.c.
..[
......o.....=......FD.....
..H..
6.230 User labuser11 logged in
--
05:12:01.399236 IP 10.25.15.182.52849 > 10.25.15.91.ftp: Flags [.], ack 1, win 229, options [nop,nop,TS val 386605559 ecr 98271947], length 0
E..4..@.@.'.
...
..[.q...?.................
..!.....
05:12:01.405574 IP 10.25.15.91.ftp > 10.25.15.182.52849: Flags [P.], seq 1:66, ack 1, win 227, options [nop,nop,TS val 98271948 ecr 386605559], length 65
E..uA @.@.. 
..[
......q.....?.............
......!.220 ProFTPD 1.3.5rc3 Server (elec1200xftp) [::ffff:10.25.15.91]

05:12:01.406324 IP 10.25.15.182.52849 > 10.25.15.91.ftp: Flags [.], ack 66, win 229, options [nop,nop,TS val 386605566 ecr 98271948], length 0
E..4..@.@.'.
...
..[.q...?.....,.....E.....
..!.....
05:12:01.410767 IP 10.25.15.182.52849 > 10.25.15.91.ftp: Flags [P.], seq 1:17, ack 66, win 229, options [nop,nop,TS val 386605570 ecr 98271948], length 16
E..D..@.@.'.
...
..[.q...?.....,...........
..".....USER labuser22

05:12:01.410867 IP 10.25.15.91.ftp > 10.25.15.182.52849: Flags [.], ack 17, win 227, options [nop,nop,TS val 98271950 ecr 386605570], length 0
E..4A!@.@..`
..[
......q...,.?.*.....1.....
......".
05:12:01.411766 IP 10.25.15.91.ftp > 10.25.15.182.52849: Flags [P.], seq 66:103, ack 17, win 227, options [nop,nop,TS val 98271950 ecr 386605570], length 37
E..YA"@.@..:
..[
......q...,.?.*....l).....
......".331 Password required for labuser22

05:12:01.412365 IP 10.25.15.182.52849 > 10.25.15.91.ftp: Flags [P.], seq 17:34, ack 103, win 229, options [nop,nop,TS val 386605572 ecr 98271950], length 17
E..E..@.@.'.
...
..[.q...?.*...Q...........
..".....PASS KJ4UJAh$Tx

05:12:01.435628 IP 10.25.15.91.ftp > 10.25.15.182.52849: Flags [P.], seq 103:133, ack 34, win 227, options [nop,nop,TS val 98271956 ecr 386605572], length 30
E..RA#@.@..@
..[
......q...Q.?.;...........
......".230 User labuser22 logged in
--
05:13:01.604578 IP 10.25.15.182.52851 > 10.25.15.91.ftp: Flags [.], ack 1, win 229, options [nop,nop,TS val 386665764 ecr 98286997], length 0
E..4,4@.@..M
...
..[.s....!.c..............
..$....
05:13:01.610915 IP 10.25.15.91.ftp > 10.25.15.182.52851: Flags [P.], seq 1:66, ack 1, win 227, options [nop,nop,TS val 98287000 ecr 386665764], length 65
E..u %@.@...
..[
......sc.....!.....x......
......$220 ProFTPD 1.3.5rc3 Server (elec1200xftp) [::ffff:10.25.15.91]

05:13:01.613313 IP 10.25.15.182.52851 > 10.25.15.91.ftp: Flags [.], ack 66, win 229, options [nop,nop,TS val 386665773 ecr 98287000], length 0
E..4,5@.@..L
...
..[.s....!.c..............
..-....
05:13:01.620002 IP 10.25.15.182.52851 > 10.25.15.91.ftp: Flags [P.], seq 1:17, ack 66, win 229, options [nop,nop,TS val 386665779 ecr 98287000], length 16
E..D,6@.@..;
...
..[.s....!.c......._......
..3....USER labuser33

05:13:01.620151 IP 10.25.15.91.ftp > 10.25.15.182.52851: Flags [.], ack 17, win 227, options [nop,nop,TS val 98287002 ecr 386665779], length 0
E..4 &@.@..[
..[
......sc.....!#.....v.....
......3
05:13:01.621051 IP 10.25.15.91.ftp > 10.25.15.182.52851: Flags [P.], seq 66:103, ack 17, win 227, options [nop,nop,TS val 98287002 ecr 386665779], length 37
E..Y '@.@..5
..[
......sc.....!#.....m.....
......3331 Password required for labuser33

05:13:01.631134 IP 10.25.15.182.52851 > 10.25.15.91.ftp: Flags [P.], seq 17:34, ack 103, win 229, options [nop,nop,TS val 386665791 ecr 98287002], length 17
E..E,7@.@..9
...
..[.s....!#c.......0......
..?....PASS N$tdUhoc6D

05:13:01.654448 IP 10.25.15.91.ftp > 10.25.15.182.52851: Flags [P.], seq 103:133, ack 34, win 227, options [nop,nop,TS val 98287011 ecr 386665791], length 30
E..R (@.@..;
..[
......sc.....!4...........
......?230 User labuser33 logged in
--
05:14:01.800283 IP 10.25.15.182.52853 > 10.25.15.91.ftp: Flags [.], ack 1, win 229, options [nop,nop,TS val 386725960 ecr 98302046], length 0
E..4..@.@...
...
..[.u......._......:......
...H...^
05:14:01.806422 IP 10.25.15.91.ftp > 10.25.15.182.52853: Flags [P.], seq 1:66, ack 1, win 227, options [nop,nop,TS val 98302048 ecr 386725960], length 65
E..u..@.@..Y
..[
......u._.................
...`...H220 ProFTPD 1.3.5rc3 Server (elec1200xftp) [::ffff:10.25.15.91]

05:14:01.807321 IP 10.25.15.182.52853 > 10.25.15.91.ftp: Flags [.], ack 66, win 229, options [nop,nop,TS val 386725967 ecr 98302048], length 0
E..4..@.@...
...
..[.u......._......9......
...O...`
05:14:01.810666 IP 10.25.15.182.52853 > 10.25.15.91.ftp: Flags [P.], seq 1:17, ack 66, win 229, options [nop,nop,TS val 386725970 ecr 98302048], length 16
E..D..@.@...
...
..[.u......._.............
...R...`USER labuser44

05:14:01.810765 IP 10.25.15.91.ftp > 10.25.15.182.52853: Flags [.], ack 17, win 227, options [nop,nop,TS val 98302049 ecr 386725970], length 0
E..4..@.@...
..[
......u._..........9......
...a...R
05:14:01.811714 IP 10.25.15.91.ftp > 10.25.15.182.52853: Flags [P.], seq 66:103, ack 17, win 227, options [nop,nop,TS val 98302050 ecr 386725970], length 37
E..Y..@.@..s
..[
......u._.................
...b...R331 Password required for labuser44

05:14:01.821449 IP 10.25.15.182.52853 > 10.25.15.91.ftp: Flags [P.], seq 17:34, ack 103, win 229, options [nop,nop,TS val 386725981 ecr 98302050], length 17
E..E..@.@...
...
..[.u......._.............
...]...bPASS fWkiP3L=Xz

05:14:01.845961 IP 10.25.15.91.ftp > 10.25.15.182.52853: Flags [P.], seq 103:133, ack 34, win 227, options [nop,nop,TS val 98302058 ecr 386725981], length 30
E..R..@.@..y
..[
......u._...........D.....
...j...]230 User labuser44 logged in
--
05:15:01.993791 IP 10.25.15.182.52855 > 10.25.15.91.ftp: Flags [.], ack 1, win 229, options [nop,nop,TS val 386786153 ecr 98317095], length 0
E..4.D@.@..=
...
..[.w..8..%.........|.....
..i..3'
05:15:01.999981 IP 10.25.15.91.ftp > 10.25.15.182.52855: Flags [P.], seq 1:66, ack 1, win 227, options [nop,nop,TS val 98317097 ecr 386786153], length 65
E..u,.@.@...
..[
......w....8..%...........
..3)..i220 ProFTPD 1.3.5rc3 Server (elec1200xftp) [::ffff:10.25.15.91]

05:15:02.001529 IP 10.25.15.182.52855 > 10.25.15.91.ftp: Flags [.], ack 66, win 229, options [nop,nop,TS val 386786161 ecr 98317097], length 0
E..4.E@.@..<
...
..[.w..8..%.........1.....
..q..3)
05:15:02.005572 IP 10.25.15.182.52855 > 10.25.15.91.ftp: Flags [P.], seq 1:17, ack 66, win 229, options [nop,nop,TS val 386786165 ecr 98317097], length 16
E..D.F@.@..+
...
..[.w..8..%.........{.....
..u..3)USER labuser55

05:15:02.005672 IP 10.25.15.91.ftp > 10.25.15.182.52855: Flags [.], ack 17, win 227, options [nop,nop,TS val 98317098 ecr 386786165], length 0
E..4,.@.@...
..[
......w....8..5...........
..3*..u
05:15:02.006471 IP 10.25.15.91.ftp > 10.25.15.182.52855: Flags [P.], seq 66:103, ack 17, win 227, options [nop,nop,TS val 98317098 ecr 386786165], length 37
E..Y,.@.@...
..[
......w....8..5....m......
..3*..u331 Password required for labuser55

05:15:02.011014 IP 10.25.15.182.52855 > 10.25.15.91.ftp: Flags [P.], seq 17:34, ack 103, win 229, options [nop,nop,TS val 386786170 ecr 98317098], length 17
E..E.G@.@..)
...
..[.w..8..5.........e.....
..z..3*PASS PKhg==d9wF

05:15:02.036623 IP 10.25.15.91.ftp > 10.25.15.182.52855: Flags [P.], seq 103:133, ack 34, win 227, options [nop,nop,TS val 98317106 ecr 386786170], length 30
E..R,.@.@...
..[
......w....8..F...........
..32..z230 User labuser55 logged in
--
05:16:01.206098 IP 10.25.15.182.52857 > 10.25.15.91.ftp: Flags [.], ack 1, win 229, options [nop,nop,TS val 386845366 ecr 98331898], length 0
E..4./@.@..R
...
..[.y....>...:.....6......
......l.
05:16:01.212386 IP 10.25.15.91.ftp > 10.25.15.182.52857: Flags [P.], seq 1:66, ack 1, win 227, options [nop,nop,TS val 98331900 ecr 386845366], length 65
E..uVa@.@...
..[
......y..:...>............
..l.....220 ProFTPD 1.3.5rc3 Server (elec1200xftp) [::ffff:10.25.15.91]

05:16:01.215233 IP 10.25.15.182.52857 > 10.25.15.91.ftp: Flags [.], ack 66, win 229, options [nop,nop,TS val 386845375 ecr 98331900], length 0
E..4.0@.@..Q
...
..[.y....>...:.....6......
......l.
05:16:01.219976 IP 10.25.15.182.52857 > 10.25.15.91.ftp: Flags [P.], seq 1:17, ack 66, win 229, options [nop,nop,TS val 386845379 ecr 98331900], length 16
E..D.1@.@..@
...
..[.y....>...:............
......l.USER labuser66

05:16:01.220075 IP 10.25.15.91.ftp > 10.25.15.182.52857: Flags [.], ack 17, win 227, options [nop,nop,TS val 98331902 ecr 386845379], length 0
E..4Vb@.@...
..[
......y..:...>.....6......
..l.....
05:16:01.220874 IP 10.25.15.91.ftp > 10.25.15.182.52857: Flags [P.], seq 66:103, ack 17, win 227, options [nop,nop,TS val 98331902 ecr 386845379], length 37
E..YVc@.@...
..[
......y..:...>............
..l.....331 Password required for labuser66

05:16:01.230059 IP 10.25.15.182.52857 > 10.25.15.91.ftp: Flags [P.], seq 17:34, ack 103, win 229, options [nop,nop,TS val 386845389 ecr 98331902], length 17
E..E.2@.@..>
...
..[.y....>...;.....6......
......l.PASS D$PBsR3AU8

05:16:01.255869 IP 10.25.15.91.ftp > 10.25.15.182.52857: Flags [P.], seq 103:133, ack 34, win 227, options [nop,nop,TS val 98331910 ecr 386845389], length 30
E..RVd@.@...
..[
......y..;...>......+.....
..m.....230 User labuser66 logged in
--
05:17:01.419125 IP 10.25.15.182.52859 > 10.25.15.91.ftp: Flags [.], ack 1, win 229, options [nop,nop,TS val 386905579 ecr 98346951], length 0
E..4..@.@.H.
...
..[.{..M...?-D......x.....
........
05:17:01.425114 IP 10.25.15.91.ftp > 10.25.15.182.52859: Flags [P.], seq 1:66, ack 1, win 227, options [nop,nop,TS val 98346953 ecr 386905579], length 65
E..u..@.@.#e
..[
......{?-D.M..............
........220 ProFTPD 1.3.5rc3 Server (elec1200xftp) [::ffff:10.25.15.91]

05:17:01.426263 IP 10.25.15.182.52859 > 10.25.15.91.ftp: Flags [.], ack 66, win 229, options [nop,nop,TS val 386905586 ecr 98346953], length 0
E..4..@.@.H.
...
..[.{..M...?-D]...........
........
05:17:01.433053 IP 10.25.15.182.52859 > 10.25.15.91.ftp: Flags [P.], seq 1:17, ack 66, win 229, options [nop,nop,TS val 386905592 ecr 98346953], length 16
E..D..@.@.Hu
...
..[.{..M...?-D].....t.....
........USER labuser77

05:17:01.433202 IP 10.25.15.91.ftp > 10.25.15.182.52859: Flags [.], ack 17, win 227, options [nop,nop,TS val 98346955 ecr 386905592], length 0
E..4..@.@.#.
..[
......{?-D]M..$...........
........
05:17:01.433901 IP 10.25.15.91.ftp > 10.25.15.182.52859: Flags [P.], seq 66:103, ack 17, win 227, options [nop,nop,TS val 98346955 ecr 386905592], length 37
E..Y..@.@.#.
..[
......{?-D]M..$....k......
........331 Password required for labuser77

05:17:01.443037 IP 10.25.15.182.52859 > 10.25.15.91.ftp: Flags [P.], seq 17:34, ack 103, win 229, options [nop,nop,TS val 386905602 ecr 98346955], length 17
E..E..@.@.Hs
...
..[.{..M..$?-D.....c......
........PASS Jy$Gm6VzMz

05:17:01.470444 IP 10.25.15.91.ftp > 10.25.15.182.52859: Flags [P.], seq 103:133, ack 34, win 227, options [nop,nop,TS val 98346964 ecr 386905602], length 30
E..R..@.@.#.
..[
......{?-D.M..5...........
........230 User labuser77 logged in
--
05:18:01.625064 IP 10.25.15.182.52861 > 10.25.15.91.ftp: Flags [.], ack 1, win 229, options [nop,nop,TS val 386965785 ecr 98362002], length 0
E..4nd@.@...
...
..[.}.....w........n......
........
05:18:01.631253 IP 10.25.15.91.ftp > 10.25.15.182.52861: Flags [P.], seq 1:66, ack 1, win 227, options [nop,nop,TS val 98362004 ecr 386965785], length 65
E..u<5@.@...
..[
......}.......w....O......
........220 ProFTPD 1.3.5rc3 Server (elec1200xftp) [::ffff:10.25.15.91]

05:18:01.632053 IP 10.25.15.182.52861 > 10.25.15.91.ftp: Flags [.], ack 66, win 229, options [nop,nop,TS val 386965792 ecr 98362004], length 0
E..4ne@.@...
...
..[.}.....w........n......
... ....
05:18:01.636097 IP 10.25.15.182.52861 > 10.25.15.91.ftp: Flags [P.], seq 1:17, ack 66, win 229, options [nop,nop,TS val 386965795 ecr 98362004], length 16
E..Dnf@.@...
...
..[.}.....w........1......
...#....USER labuser88

05:18:01.636197 IP 10.25.15.91.ftp > 10.25.15.182.52861: Flags [.], ack 17, win 227, options [nop,nop,TS val 98362005 ecr 386965795], length 0
E..4<6@.@..K
..[
......}............n......
.......#
05:18:01.637095 IP 10.25.15.91.ftp > 10.25.15.182.52861: Flags [P.], seq 66:103, ack 17, win 227, options [nop,nop,TS val 98362006 ecr 386965795], length 37
E..Y<7@.@..%
..[
......}.............x.....
.......#331 Password required for labuser88

05:18:01.647130 IP 10.25.15.182.52861 > 10.25.15.91.ftp: Flags [P.], seq 17:34, ack 103, win 229, options [nop,nop,TS val 386965807 ecr 98362006], length 17
E..Eng@.@..	
...
..[.}...............*.....
.../....PASS Wwod7b$HKP

05:18:01.669693 IP 10.25.15.91.ftp > 10.25.15.182.52861: Flags [P.], seq 103:133, ack 34, win 227, options [nop,nop,TS val 98362014 ecr 386965807], length 30
E..R<8@.@..+
..[
......}...................
......./230 User labuser88 logged in
